Полное наименование	Группа	Вид контрагента	ИНН	Имя досье
				
		Юридическое лицо	7734725684	
	Поставщики	Юридическое лицо		
	Поставщики	Юридическое лицо	7717739687	
	Поставщики	Юридическое лицо	7718542411	
	Поставщики	Юридическое лицо	773401814574	
 Индивидуальный предприниматель Егоров Павел Андреевич		Физическое лицо	771682713906	
 Индивидуальный предприниматель Кустаров Павел Викторович		Физическое лицо	231134569638	
 ИП Лоцманов Иван Эдуардович		Физическое лицо	760708530475	
*Торговый дом Северо-западный	Поставщики	Юридическое лицо	7825444144	
АГРОПЛАСТКОМ		Юридическое лицо	7104519918	
Активные технологии	Покупатели	Юридическое лицо	7705898788	
Акционерное Общество  "ДЕЛОВЫЕ ЛИНИИ"	Поставщики	Юридическое лицо	7730534174	
Акционерное Общество "АРМО-ГРУПП"	Покупатели	Юридическое лицо	7715216850	
Акционерное общество "ТРАНСКЕМИКЛ-экспресс"	Поставщики	Юридическое лицо	5005041909	
Альфа-Банк	Поставщики	Юридическое лицо		
АНО ДПО "ИПТСУ"		Юридическое лицо	7723390027	
АНО ДПО УЧЕБНЫЙ ЦЕНТР "ПРОМСТРОЙГАЗ"	Поставщики	Юридическое лицо	5406590536	
АО "АКВИЛОН"	Поставщики	Юридическое лицо	5190086468	Досье_АКВИЛОН АО.pdf
АО "АЛЬФА-БАНК"		Юридическое лицо	7728168971	
АО "АльфаСтрахование"		Юридическое лицо	7713056834	
АО "ГИЦ ПВ"		Юридическое лицо	7729634008	
АО "ГМС ЛИВГИДРОМАШ"	Поставщики	Юридическое лицо	5702000265	
АО "Молодинское"		Юридическое лицо	5048081617	
АО "МОСОБЛЭНЕРГО"		Юридическое лицо	5032137342	
АО "НОВОЕ КАЧЕСТВО ДОРОГ"	Поставщики	Юридическое лицо	7726404976	Досье_НОВОЕ КАЧЕСТВО ДОРОГ АО.pdf
АО "ОКТЕКС"		Юридическое лицо	5027070068	
АО "Первый"		Юридическое лицо	3812107585	
АО "ПФ "СКБ КОНТУР"	Поставщики	Юридическое лицо	6663003127	
АО "Райффайзенбанк" г. Москва		Юридическое лицо	7744000302	
АО "Раменский водоканал"		Юридическое лицо	5040109194	
АО "РОЛЬФ"	Поставщики	Юридическое лицо	5047254063	Досье_РОЛЬФ АО.pdf
АО "СИТИ-XXI ВЕК"	Покупатели	Юридическое лицо	7709231603	
АО "СПЕЦИАЛИЗИРОВАННЫЙ ЗАСТРОЙЩИК "ЭЛИТГРАД"	Покупатели	Юридическое лицо	7722458392	Досье_СПЕЦИАЛИЗИРОВАННЫЙ ЗАСТРОЙЩИК ЭЛИТГРАД АО.pdf
АО "ТД ТРАКТ"	Поставщики	Юридическое лицо	7723627621	
АО "ТЕЛЕОФИС"	Поставщики	Юридическое лицо	7726593280	Досье_ТЕЛЕОФИС АО.pdf
АО "ТРИЕМА"	Поставщики	Юридическое лицо	3662103003	
АО "ЦРЭ"	Поставщики	Юридическое лицо	5034031535	
АО "Элевел Инженер"		Юридическое лицо	5001112612	
АО "ЭФФЕКТ-ЭКО"	Поставщики	Юридическое лицо	5036032051	
АО СМФ "ВЕСТ-ВЕСТ"		Юридическое лицо	2315070767	Досье_ВЕСТ-ВЕСТ АО СМФ.pdf
АО ЦНИИС	Поставщики	Юридическое лицо	7716007031	
АС "ПОМОЩЬ"	Поставщики	Юридическое лицо	9703013602	Досье_ПОМОЩЬ АС.pdf
АС "УК "СтройИнвест"		Юридическое лицо	7811290085	
АС КАДАСТРОВЫХ ИНЖЕНЕРОВ "СТРОЙПАРТНЕР"	Поставщики	Юридическое лицо	7811608057	
Бадалян Арман Рафикович	Поставщики	Физическое лицо		
Бокоева Алина Мамиконовна	Поставщики	Физическое лицо	772479357730	
Болотсков Игорь Викторович	Поставщики	Физическое лицо	694400896921	Досье_СЗ Болотсков Игорь Викторович.pdf
ВЕЛЕС-СТРОЙ		Юридическое лицо	7703823882	
Войтенко Андрей Дмитриевич		Физическое лицо		
ВОЙТЕНКО АНДРЕЙ ДМИТРИЕВИЧ (ИП)		Физическое лицо	402809497006	
Войтенко Владимир Андреевич	Поставщики	Физическое лицо	402809651314	Досье_СЗ Войтенко Владимир Андреевич.pdf
Воробьёв Юрий Михайлович	Поставщики	Физическое лицо	666402518126	Досье_СЗ Воробьёв Юрий Михайлович.pdf
ВЫМПЕЛКОМ	Поставщики	Юридическое лицо	7713076301	
Гарейс Александр Иванович	Поставщики	Физическое лицо	553001483513	Досье_СЗ Гарейс Александр Иванович.pdf
Геликон-Эппл	Поставщики	Юридическое лицо	7716196741	
ГКУ ЦФО ДОНМ	Государственные органы	Юридическое лицо	9718071371	
Горшков Семен Валерьевич	Поставщики	Физическое лицо	210201330353	
Грузовое такси "ГАЗЕЛЬКИН"		Юридическое лицо	7839382402	
ДНП "НИКОЛЬСКИЕ ОЗЕРА"	Покупатели	Юридическое лицо	7730697796	
ДОЛГОПОЛОВА ЮЛИЯ ВЛАДИСЛАВОВНА	Поставщики	Физическое лицо	511006499490	Досье_СЗ ДОЛГОПОЛОВА ЮЛИЯ ВЛАДИСЛАВОВНА.pdf
Духанов Евгений Олегович Самозанятый		Физическое лицо		
ЕЛИСЕЕВА АЛЛА АНАТОЛЬЕВНА		Физическое лицо		
Ермаков Дмитрий Владимирович	Поставщики	Физическое лицо	772773666050	Досье_СЗ Ермаков Дмитрий Владимирович.pdf
Закрытое акционерное общество "РОСМА"	Поставщики	Юридическое лицо	4719015564	
ЗАО "ГИДРОРЕМСТРОЙ"		Юридическое лицо	5030043032	
ЗАО "ДСК-СТОЛИЦА"	Поставщики	Юридическое лицо	7721823772	
ЗАО "МПО Электромонтаж"	Поставщики	Юридическое лицо	7719079370	
ЗАО "СВЯЗЬСТРОЙДЕТАЛЬ"	Поставщики	Юридическое лицо	7723005557	
ЗАО "ТД Доминик"		Юридическое лицо	7715994096	
ЗАО "ЧИП и ДИП"		Юридическое лицо	7729108750	
ЗАО МОСИНТЕРМ		Юридическое лицо	5006008848	
Иванов Владимир Александрович ИП	Проблемные поставщики	Физическое лицо	370250933122	
Иванов Павел Николаевич		Физическое лицо		
Индивидуальный предприниматель Авакян Масис Камоевич		Физическое лицо	502920122286	
Индивидуальный предприниматель Агаронян Артур Жораевич		Физическое лицо	773322903648	
Индивидуальный предприниматель Акбашев Наиль Мухаметович		Физическое лицо	772465061081	
Индивидуальный предприниматель Балабанов Игорь Александрович		Физическое лицо	402571421086	
Индивидуальный предприниматель Бобров Антон Васильевич		Физическое лицо	500709943016	
Индивидуальный предприниматель Большедворский Олег Владимирович	Поставщики	Физическое лицо	505014077447	Досье_ИП Большедворский Олег Владимирович.pdf
Индивидуальный предприниматель Воронко Алексей Александрович		Физическое лицо	502716837301	
Индивидуальный предприниматель Горенков Даниил Владимирович		Физическое лицо	772374219236	
Индивидуальный предприниматель Данилович Дмитрий Александрович	Поставщики	Физическое лицо	772700568692	
Индивидуальный предприниматель Дубовик А.Ю.	Поставщики	Физическое лицо	503219460174	
Индивидуальный предприниматель Еремеева Ирина Владимировна		Физическое лицо	771373353572	
Индивидуальный предприниматель Ильина Ирина Владимировна	Поставщики	Физическое лицо	740501016550	Досье_ИП Ильина Ирина Владимировна.pdf
Индивидуальный предприниматель Ковач Сергей Иванович	Поставщики	Физическое лицо	692301852944	Досье_ИП Ковач Сергей Иванович.pdf
Индивидуальный предприниматель Колпаков Андрей Евгеньевич		Физическое лицо	667330377556	
Индивидуальный предприниматель Коробков Дмитрий Александрович	Поставщики	Физическое лицо	463302433823	
Индивидуальный предприниматель Коровай Артем Олегович	Поставщики	Физическое лицо	421713987900	Досье_ИП Коровай Артем Олегович.pdf
Индивидуальный предприниматель Левин Андрей Владимирович		Физическое лицо	910200382277	
Индивидуальный предприниматель Мартынов Сергей Валентинович	Поставщики	Физическое лицо	502700458308	Досье_ИП Мартынов Сергей Валентинович.pdf
Индивидуальный предприниматель Петракова Анна Сергеевна		Физическое лицо	503008450321	
Индивидуальный предприниматель Севостьянова Юлия Алексеевна	Поставщики	Физическое лицо	503121120157	Досье_ИП Севостьянова Юлия Алексеевна.pdf
Индивидуальный предприниматель Семирядов Александр		Физическое лицо	672211608787	
Индивидуальный предприниматель Сидоров Роман Юрьевич		Физическое лицо	501210128919	
Индивидуальный предприниматель Тахири Юлия	Поставщики	Физическое лицо	502750020044	Досье_ИП Тахири Юлия.pdf
Индивидуальный предприниматель Толстобров Станислав Олегович	Поставщики	Физическое лицо	434581265030	Досье_ИП Толстобров Станислав Олегович.pdf
Индивидуальный предприниматель Ушлик Олег Анатольевич		Физическое лицо	772501342203	
Индивидуальный предприниматель Хисамутдинов Рустам Асиятуллаевич		Физическое лицо	564303508748	Досье_ИП Хисамутдинов Рустам Асиятуллаевич.pdf
Индивидуальный предприниматель Христолюбов Виктор Николаевич		Физическое лицо	312335702440	
Индивидуальный предприниматель Штукин Андрей Алексеевич		Физическое лицо	773573154120	Досье_ИП Штукин Андрей Алексеевич.pdf
Индивидуальный Предприниматель Шуляев Алексей Николаевич		Физическое лицо	772505498804	
Инспекция Федеральной налоговой службы № 16 по г. Москве	Государственные органы	Юридическое лицо	7716103458	
Инспекция Федеральной налоговой службы № 17 по г.Москве		Юридическое лицо	7717018935	
ИП "Каплунов Андрей Вячеславович"		Физическое лицо	772003662899	
ИП Абдразакова Сания Минтагировна	Покупатели	Физическое лицо	502500284661	Досье_ИП Абдразакова Сания Минтагировна.pdf
ИП Аболимова Раиса Николаевна	Поставщики	Физическое лицо	772441692708	
ИП Аверюшкин Эдуард Станиславович	Поставщики	Физическое лицо	772026946872	Досье_ИП Аверюшкин Эдуард Станиславович.pdf
ИП Айнетдинов Тимур Ренатович	Поставщики	Физическое лицо	503809997973	Досье_ИП Айнетдинов Тимур Ренатович.pdf
ИП Алексашин Никита Денисович	Поставщики	Физическое лицо	770307116190	
ИП Амоншоев Шавкат Аскаршохевич	Поставщики	Физическое лицо	775111582999	
ИП Антонова Виктория Викторовна		Физическое лицо	504407429436	
ИП Афанасьев Алексей Анатольевич	Поставщики	Физическое лицо	772978322691	Досье_ИП Афанасьев Алексей Анатольевич.pdf
ИП Афонин Николай Николаевич	Поставщики	Физическое лицо	500701970956	Досье_ИП Афонин Николай Николаевич.pdf
ИП Ахмадиев Гали Рифкатович	Поставщики	Физическое лицо	772321852533	Досье_ИП Ахмадиев Гали Рифкатович.pdf
ИП Баранов Александр Викторович		Физическое лицо	710602761375	
ИП Беленко Анатолий Александрович		Физическое лицо	772452113102	
ИП Беленко Максим Анатольевич		Физическое лицо	500308361613	
ИП Беликов Владимир Николаевич	Поставщики	Физическое лицо	505602192380	Досье_ИП Беликов Владимир Николаевич.pdf
ИП Блануца Александр Николаевич	Поставщики	Физическое лицо	470500453974	
ИП Бобрышев Олег Александрович	Поставщики	Физическое лицо	614445490007	Досье_ИП Бобрышев Олег Александрович.pdf
ИП Брянка Константин Ярославович	Поставщики	Физическое лицо	772633760648	
ИП Буров Михаил Андреевич		Физическое лицо	360409656221	
ИП Варакс Юрий Викторович	Поставщики	Физическое лицо	770604649507	Досье_ИП Варакс Юрий Викторович.pdf
ИП Веселова Дарья Михайловна	Поставщики	Физическое лицо	773137398550	Досье_ИП Веселова Дарья Михайловна.pdf
ИП Винникова Елена Викторовна	Поставщики	Физическое лицо	440503425493	
ИП Власов Иван Александрович	Поставщики	Физическое лицо	502411721359	
ИП Галстян Вагаршак Артурович	Поставщики	Физическое лицо	972101036373	Досье_ИП Галстян Вагаршак Артурович.pdf
ИП Гафаров Р.		Физическое лицо	773613031776	
ИП Гончарова Елена Владимировна		Физическое лицо	501815631317	
ИП Гребенников Евгений Сергеевич	Поставщики	Физическое лицо	243905952877	
ИП Гречуха Алексей Николаевич		Физическое лицо	773433099302	
ИП Грошев Александр Николаевич		Физическое лицо	771665041901	
ИП Гудинова Наталья Николаевна	Поставщики	Физическое лицо	301803754213	
ИП Гурин Михаил Валерьевич	Поставщики	Физическое лицо	332103681306	
ИП Девлетова Э. И.		Физическое лицо	330646542904	
ИП Децик Владимир Ильич	Поставщики	Физическое лицо	500313123614	Досье_ИП Децик Владимир Ильич .pdf
ИП Дроботова Екатерина Александровна	Поставщики	Физическое лицо	540302059105	Досье_ИП Дроботова Екатерина Александровна.pdf
ИП Дубинин Игорь Владимирович	Поставщики	Физическое лицо	772351374027	Досье_ИП Дубинин Игорь Владимирович.pdf
ИП Духанов Евгений Олегович	Поставщики	Физическое лицо	504401583907	
ИП Дюмин Юрий Алексеевич	Поставщики	Физическое лицо	390600178150	
ИП Ермошин Валерий Викторович	Поставщики	Физическое лицо	503002498581	Досье_ИП Ермошин Валерий Викторович.pdf
ИП Журкина Светлана Леонидовна		Физическое лицо	500104675266	
ИП Жучкова Светлана Васильевна	Поставщики	Физическое лицо	500708067599	
ИП Зенова Галина Петровна		Физическое лицо	505000819480	
ИП Зибарев Арсений Евгеньевич	Поставщики	Физическое лицо	910228034343	
ИП Зоммер Марина Евгеньевна	Поставщики	Физическое лицо	616132598609	Досье_ИП Зоммер Марина Евгеньевна.pdf
ИП Зотов Алексей Николаевич		Физическое лицо	575404564803	
ИП Зубарева Вероника Александровна	Поставщики	Физическое лицо	231406386023	
ИП Иджаз Анас Ахмадович		Физическое лицо	504226885885	
ИП Иевлев Александр Дмитриевич	Поставщики	Физическое лицо	501811327524	Досье_ИП Иевлев Александр Дмитриевич.pdf
ИП Израилев Дмитрий Максимович	Поставщики	Физическое лицо	431207454309	
ИП Казаков Сергей Юрьевич	Поставщики	Физическое лицо	772313260854	
ИП Кирпичёв Александр Витальевич	Поставщики	Физическое лицо	500603856211	Досье_ИП Кирпичёв Александр Витальевич.pdf
ИП Кирчу Федор Гаврилович	Поставщики	Физическое лицо	972700206578	Досье_ИП Кирчу Федор Гаврилович.pdf
ИП Кисель Алексей Иванович	Поставщики	Физическое лицо	780534789536	Досье_ИП Кисель Алексей Иванович.pdf
ИП Князева Наталья Николаевна	Поставщики	Физическое лицо	507401508101	
ИП Ковальчук Д.И.		Физическое лицо	501215011625	
ИП Козлов Виктор Иванович	Поставщики	Физическое лицо	504400252483	Досье_ИП Козлов Виктор Иванович.pdf
ИП Койро Кирилл Викторович	Поставщики	Физическое лицо	390706202438	Досье_ИП Койро Кирилл Викторович.pdf
ИП Колганов Александр Николаевич	Поставщики	Физическое лицо	771305227033	
ИП Колотов Константин Александрович	Поставщики	Физическое лицо	502717498852	
ИП Колупаев Дмитрий Владимирович	Поставщики	Физическое лицо	504405376235	
ИП Колупаев Олег Витальевич	Поставщики	Физическое лицо	503228937135	Досье_ИП Колупаев Олег Витальевич .pdf
ИП Комнатный В. А.	Поставщики	Физическое лицо	010515701130	Досье_ИП Комнатный В. А..pdf
ИП Кореньков Павел Алексеевич	Поставщики	Физическое лицо	631219714275	
ИП Коробков Александр Александрович	Поставщики	Физическое лицо	463302433502	
ИП Коробкова Анна Андреевна	Поставщики	Физическое лицо	301726031200	Досье_ИП Коробкова Анна Андреевна.pdf
ИП Коротаева Валентина Юрьевна	Поставщики	Физическое лицо	691007614693	
ИП Коток Юрьевна		Физическое лицо	774314460835	
ИП Крылов Андрей Николаевич		Физическое лицо	662913261628	
ИП Кудрик Евгений Борисович	Поставщики	Физическое лицо	450126601972	Досье_ИП Кудрик Евгений Борисович.pdf
ИП Кульбацкий Владимир Олегович	Поставщики	Физическое лицо	860221952424	Досье_ИП Кульбацкий Владимир Олегович.pdf
ИП Курдов Роман Арсланович	Поставщики	Физическое лицо	507902326102	
ИП Кухарчук Василий Михайлович		Физическое лицо	781414707910	
ИП Лазарев Виталий Валерьевич	Поставщики	Физическое лицо	272191189157	Досье_ИП Лазарев Виталий Валерьевич.pdf
ИП Левина Дарья Владимировна	Поставщики	Физическое лицо	482418037989	Досье_ИП Левина Дарья Владимировна.pdf
ИП Лесничий Яков Васильевич	Поставщики	Физическое лицо	231302744108	Досье_ИП Лесничий Яков Васильевич.pdf
ИП Литвинова Виктория Викторовна	Поставщики	Физическое лицо	615429335430	Досье_ИП Литвинова Виктория Викторовна.pdf
ИП Лихачев Вячеслав Адольфович	Поставщики	Физическое лицо	780512029740	
ИП Лопанов Вячеслав Владимирович	Поставщики	Физическое лицо	503007732115	Досье_ИП Лопанов Вячеслав Владимирович.pdf
ИП Майструк Марина Алексеевна		Физическое лицо	501707111303	
ИП Макаров Игорь Петрович		Физическое лицо	780405684623	
ИП Маматохунов Жахонгирбек Ниязович		Физическое лицо	504215338707	
ИП Марданян Татул Арташович		Физическое лицо	504413718820	
ИП Маркина Ирина Вячеславовна	Поставщики	Физическое лицо	774305854470	
ИП МАРКОВ СЕРГЕЙ ВЛАДИМИРОВИЧ		Физическое лицо	507803252499	
ИП МАРТЫНЕНКО АНДРЕЙ ДМИТРИЕВИЧ		Физическое лицо	645493707290	
ИП МАРТЫЧ АНАСТАСИЯ НИКОЛАЕВНА		Физическое лицо	662512186902	
ИП Матвеев Андрей Михайлович	Поставщики	Физическое лицо	543810635356	
ИП Микаилова Сусанна	Поставщики	Физическое лицо	770483564503	
ИП Миронюк Александр Владимирович	Поставщики	Физическое лицо	772863903795	
ИП Могильный Андрей Владимирович	Поставщики	Физическое лицо	590299346042	
